{
  "version": "1.0.0",
  "generated_by": "scripts/build_layouts.py (complexity-review Phase 1)",
  "default": {
    "slice_kind": "project",
    "slice_key_field": "project_id",
    "slice_label_field": "project_id",
    "banner": {
      "enabled": true,
      "content_source": "PROJECT_CONTENT",
      "suppress_if_null": true,
      "no_fabricate": true,
      "absorbed_stats": []
    },
    "widgets": [
      {
        "id": "overview_stats",
        "type": "stat_strip",
        "title": "At a glance",
        "size": "md",
        "show_if": {
          "predicate": "always"
        },
        "data_binding": {
          "source": "sample_count"
        },
        "annotations": {
          "caption": "Headline counts; absorbs facts cut from degenerate charts."
        }
      },
      {
        "id": "sample_types",
        "type": "doughnut",
        "title": "Sample Types",
        "size": "md",
        "show_if": {
          "predicate": "distinct_gte",
          "field": "sample_types",
          "value": 3
        },
        "data_binding": {
          "source": "sample_types"
        },
        "annotations": {
          "caption": "Shown only with >=3 substrate values (else folded into At a glance)."
        }
      },
      {
        "id": "pipeline",
        "type": "pipeline_bar",
        "title": "Processing Pipeline",
        "size": "md",
        "show_if": {
          "not": {
            "predicate": "all_equal"
          }
        },
        "data_binding": {
          "source": "pipeline"
        },
        "annotations": {
          "empty_state": "Collected \u2014 processing not yet begun.",
          "caption": "Funnel when stages differ; explicit empty-state when sequenced == 0."
        }
      },
      {
        "id": "pipeline_complete",
        "type": "completion_badge",
        "title": "Fully processed",
        "size": "sm",
        "show_if": {
          "predicate": "all_equal"
        },
        "data_binding": {
          "source": "pipeline"
        },
        "annotations": {
          "caption": "Replaces a flat three-equal-bar pipeline with one completion stat."
        }
      },
      {
        "id": "temporal",
        "type": "temporal_bar",
        "title": "Collection Over Time",
        "size": "md",
        "show_if": {
          "all": [
            {
              "predicate": "months_gte",
              "value": 2
            },
            {
              "predicate": "top_share_lt",
              "value": 0.85
            }
          ]
        },
        "data_binding": {
          "source": "temporal",
          "transform": "group_by_year"
        },
        "annotations": {
          "caption": "Gap-aware; suppressed for single-month or single-month-dominated projects."
        }
      },
      {
        "id": "sampler",
        "type": "bar",
        "title": "Sampler Types",
        "size": "md",
        "show_if": {
          "all": [
            {
              "predicate": "distinct_gte",
              "field": "sampler",
              "value": 2
            },
            {
              "predicate": "coverage_gte",
              "field": "sampler",
              "value": 0.95
            }
          ]
        },
        "data_binding": {
          "source": "sampler_type_dist",
          "transform": "sort_desc",
          "denominator": "sample_count"
        },
        "annotations": {
          "unspecified_remainder": true,
          "caption": "Default shows only with >=2 samplers AND near-full coverage; eval campaigns promote it via override."
        }
      },
      {
        "id": "tags",
        "type": "badge_row",
        "title": "Replicate & Design Tags",
        "size": "sm",
        "show_if": {
          "any": [
            {
              "predicate": "tag_group_nonempty",
              "name": "AM/PM"
            },
            {
              "predicate": "tag_group_nonempty",
              "name": "Replicate"
            },
            {
              "predicate": "tag_group_nonempty",
              "name": "Position"
            },
            {
              "predicate": "tag_group_nonempty",
              "name": "Quadrant"
            },
            {
              "predicate": "tag_group_nonempty",
              "name": "Field Control"
            }
          ]
        },
        "data_binding": {
          "source": "tag_groups"
        },
        "annotations": {
          "caption": "Suppressed when no tag group is populated; a populated dimension may be promoted to its own chart via override."
        }
      }
    ]
  },
  "projects": {
    "IMPROVE Fungi": {
      "slice_kind": "project",
      "slice_key_field": "project_id",
      "slice_label_field": "project_id",
      "banner": {
        "enabled": true,
        "content_source": "PROJECT_CONTENT",
        "suppress_if_null": true,
        "no_fabricate": true,
        "absorbed_stats": []
      },
      "widgets": [
        {
          "id": "overview_stats",
          "type": "stat_strip",
          "title": "At a glance",
          "size": "md",
          "show_if": {
            "predicate": "always"
          },
          "data_binding": {
            "source": "sample_count"
          },
          "annotations": {
            "caption": "Headline counts; absorbs facts cut from degenerate charts."
          }
        },
        {
          "id": "sample_types",
          "type": "doughnut",
          "title": "Sample Types",
          "size": "md",
          "show_if": {
            "predicate": "distinct_gte",
            "field": "sample_types",
            "value": 3
          },
          "data_binding": {
            "source": "sample_types"
          },
          "annotations": {
            "caption": "Shown only with >=3 substrate values (else folded into At a glance)."
          }
        },
        {
          "id": "pipeline",
          "type": "pipeline_bar",
          "title": "Processing Pipeline",
          "size": "md",
          "show_if": {
            "not": {
              "predicate": "all_equal"
            }
          },
          "data_binding": {
            "source": "pipeline"
          },
          "annotations": {
            "empty_state": "Collected \u2014 processing not yet begun.",
            "caption": "Funnel when stages differ; explicit empty-state when sequenced == 0."
          }
        },
        {
          "id": "pipeline_complete",
          "type": "completion_badge",
          "title": "Fully processed",
          "size": "sm",
          "show_if": {
            "predicate": "all_equal"
          },
          "data_binding": {
            "source": "pipeline"
          },
          "annotations": {
            "caption": "Replaces a flat three-equal-bar pipeline with one completion stat."
          }
        },
        {
          "id": "temporal",
          "type": "temporal_bar",
          "title": "Collection Over Time",
          "size": "md",
          "show_if": {
            "all": [
              {
                "predicate": "months_gte",
                "value": 2
              },
              {
                "predicate": "top_share_lt",
                "value": 0.85
              }
            ]
          },
          "data_binding": {
            "source": "temporal",
            "transform": "group_by_year"
          },
          "annotations": {
            "caption": "Gap-aware; suppressed for single-month or single-month-dominated projects."
          }
        },
        {
          "id": "sampler",
          "type": "bar",
          "title": "Sampler Types",
          "size": "md",
          "show_if": {
            "all": [
              {
                "predicate": "distinct_gte",
                "field": "sampler",
                "value": 2
              },
              {
                "predicate": "coverage_gte",
                "field": "sampler",
                "value": 0.95
              }
            ]
          },
          "data_binding": {
            "source": "sampler_type_dist",
            "transform": "sort_desc",
            "denominator": "sample_count"
          },
          "annotations": {
            "unspecified_remainder": true,
            "caption": "Default shows only with >=2 samplers AND near-full coverage; eval campaigns promote it via override."
          }
        },
        {
          "id": "tags",
          "type": "badge_row",
          "title": "Replicate & Design Tags",
          "size": "sm",
          "show_if": {
            "any": [
              {
                "predicate": "tag_group_nonempty",
                "name": "AM/PM"
              },
              {
                "predicate": "tag_group_nonempty",
                "name": "Replicate"
              },
              {
                "predicate": "tag_group_nonempty",
                "name": "Position"
              },
              {
                "predicate": "tag_group_nonempty",
                "name": "Quadrant"
              },
              {
                "predicate": "tag_group_nonempty",
                "name": "Field Control"
              }
            ]
          },
          "data_binding": {
            "source": "tag_groups"
          },
          "annotations": {
            "caption": "Suppressed when no tag group is populated; a populated dimension may be promoted to its own chart via override."
          }
        }
      ]
    },
    "Fragmented Landscape": {
      "slice_kind": "project",
      "slice_key_field": "project_id",
      "slice_label_field": "project_id",
      "banner": {
        "enabled": true,
        "content_source": "PROJECT_CONTENT",
        "suppress_if_null": true,
        "no_fabricate": true,
        "absorbed_stats": []
      },
      "widgets": [
        {
          "id": "overview_stats",
          "type": "stat_strip",
          "title": "At a glance",
          "size": "md",
          "show_if": {